{
  "id": "eval_optional_adapters",
  "name": "Optional Adapter Discovery",
  "scope": "mcp",
  "version": 1,
  "graders": [
    {
      "id": "adapter-smoke",
      "type": "command",
      "command": "npm run adapters:smoke"
    },
    {
      "id": "adapter-registry-file",
      "type": "file_exists",
      "path": "packages/intelligence/adapters/optional-adapters.json"
    }
  ],
  "successCriteria": [
    "Built-in semantic adapter is available without external services.",
    "Missing optional Serena and Graphiti adapters degrade cleanly.",
    "Adapter registry validates without network access."
  ]
}
