{
  "id": "eval_100_eval_reliability",
  "name": "100 Score Eval Reliability",
  "scope": "evals",
  "version": 1,
  "description": "Measures pass@k and pass^k against a real repository validation command.",
  "graders": [
    {
      "id": "task_attempt_reliability",
      "type": "task_attempt",
      "command": "npm run workflows:validate",
      "attempts": 3,
      "timeoutMs": 30000
    }
  ],
  "successCriteria": [
    "pass@1, pass@3, and pass^3 are recorded from repeated real command attempts."
  ],
  "requiresApproval": false
}
